{
  "id": "persistence.datastore_safe",
  "name": "DataStore Safe",
  "category": "persistence",
  "description": "Wraps raw platform datastore calls with retry/backoff, request budgeting, and corruption checks so save data never gets silently dropped.",
  "version": "0.1.0",
  "platform": ["roblox", "agnostic"],
  "inputs": [
    {"name": "maxRetries", "type": "number", "required": false, "default": 3},
    {"name": "backoffSeconds", "type": "number", "required": false, "default": 2}
  ],
  "outputs": [
    {"name": "pendingWrites", "type": "number"}
  ],
  "events": {"emits": ["persistence.writeSucceeded", "persistence.writeExhausted"], "listensTo": ["persistence.saved"]},
  "dependencies": ["persistence.save_system"],
  "tags": ["reliability", "datastore"],
  "sourceModule": "roblox-modular-lib/src/DataStoreSafe.lua"
}
